"X1","X2","X3","status","formatted_address","index","lat","long","accuracy"
NA,NA,NA,"OK","Poyang, Shangrao, Jiangxi, China",1200,29.011699,116.699746,"political"
NA,NA,NA,"OK","Wannian, Shangrao, Jiangxi, China",1201,28.694582,117.058445,"political"
NA,NA,NA,"OK","Wuyuan, Shangrao, Jiangxi, China",1202,29.248085,117.861797,"political"
NA,NA,NA,"OK","Dexing, Shangrao, Jiangxi, China",1203,28.946464,117.578713,"political"
NA,NA,NA,"OK","Lixia, Jinan, Shandong, China",1204,36.666465,117.076441,"political"
NA,NA,NA,"OK","Shizhong, Jinan, Shandong, China",1205,36.651335,116.997845,"political"
NA,NA,NA,"OK","Huaiyin, Jinan, Shandong, China, 250000",1206,36.651441,116.901224,"political"
NA,NA,NA,"OK","Tianqiao, Jinan, Shandong, China",1207,36.678015,116.987491,"political"
NA,NA,NA,"OK","Licheng, Jinan, Shandong, China",1208,36.680259,117.06523,"political"
NA,NA,NA,"OK","Changqing, Jinan, Shandong, China",1209,36.553769,116.751986,"political"
NA,NA,NA,"OK","Pingyin, Jinan, Shandong, China",1210,36.289265,116.456187,"political"
NA,NA,NA,"OK","Jiyang, Jinan, Shandong, China",1211,36.978537,117.173524,"political"
NA,NA,NA,"OK","Shanghe, Jinan, Shandong, China",1212,37.309045,117.157183,"political"
NA,NA,NA,"OK","Zhangqiu, Jinan, Shandong, China",1213,36.681259,117.526228,"political"
NA,NA,NA,"OK","Shinan, Qingdao, Shandong, China",1214,36.075651,120.412392,"political"
NA,NA,NA,"OK","Shibei, Qingdao, Shandong, China",1215,36.0876,120.374701,"political"
NA,NA,NA,"OK","Huangdao, Qingdao, Shandong, China",1216,35.872664,120.04619,"political"
NA,NA,NA,"OK","Laoshan, Qingdao, Shandong, China",1217,36.107538,120.468956,"political"
NA,NA,NA,"OK","Licang, Qingdao, Shandong, China",1218,36.145463,120.432696,"political"
NA,NA,NA,"OK","Chengyang, Qingdao, Shandong, China",1219,36.307064,120.39631,"political"
NA,NA,NA,"OK","Jiaozhou, Qingdao, Shandong, China",1220,36.285877,120.006202,"political"
NA,NA,NA,"OK","Jimo, Qingdao, Shandong, China",1221,36.389401,120.44716,"political"
NA,NA,NA,"OK","Pingdu, Qingdao, Shandong, China",1222,36.776357,119.98842,"political"
NA,NA,NA,"OK","Laixi, Qingdao, Shandong, China",1223,36.889084,120.51769,"political"
NA,NA,NA,"OK","Zichuan, Zibo, Shandong, China",1224,36.643452,117.966723,"political"
NA,NA,NA,"OK","Zhangdian, Zibo, Shandong, China",1225,36.806669,118.017938,"political"
NA,NA,NA,"OK","Boshan, Zibo, Shandong, China",1226,36.494701,117.861851,"political"
NA,NA,NA,"OK","Linzi, Zibo, Shandong, China",1227,36.826981,118.309118,"political"
NA,NA,NA,"OK","Zhoucun, Zibo, Shandong, China",1228,36.803072,117.869886,"political"
NA,NA,NA,"OK","Huantai, Zibo, Shandong, China",1229,36.959804,118.097922,"political"
NA,NA,NA,"OK","Gaoqing, Zibo, Shandong, China",1230,37.170979,117.826924,"political"
NA,NA,NA,"OK","Yiyuan, Zibo, Shandong, China",1231,36.185038,118.170855,"political"
NA,NA,NA,"OK","Shizhong, Jinan, Shandong, China",1232,36.651335,116.997845,"political"
NA,NA,NA,"OK","Xuecheng, Zaozhuang, Shandong, China",1233,34.795062,117.263164,"political"
NA,NA,NA,"OK","Yicheng, Zaozhuang, Shandong, China",1234,34.773263,117.590815,"political"
NA,NA,NA,"OK","Tai'erzhuang, Zaozhuang, Shandong, China",1235,34.56244,117.734414,"political"
NA,NA,NA,"OK","Shanting, Zaozhuang, Shandong, China",1236,35.099528,117.461517,"political"
NA,NA,NA,"OK","Tengzhou, Zaozhuang, Shandong, China",1237,35.084021,117.164388,"political"
NA,NA,NA,"OK","Dongying, Shandong, China",1238,37.448963,118.582184,"political"
NA,NA,NA,"OK","Hekou, Dongying, Shandong, China",1239,37.886162,118.525543,"political"
NA,NA,NA,"OK","Kenli, Dongying, Shandong, China",1240,37.572355,118.575408,"political"
NA,NA,NA,"OK","Lijin, Dongying, Shandong, China",1241,37.490328,118.255287,"political"
NA,NA,NA,"OK","Guangrao, Dongying, Shandong, China",1242,37.053555,118.407107,"political"
NA,NA,NA,"OK","Zhifu, Yantai, Shandong, China",1243,37.541475,121.400445,"political"
NA,NA,NA,"OK","Fushan, Yantai, Shandong, China",1244,37.498246,121.267741,"political"
NA,NA,NA,"OK","Muping, Yantai, Shandong, China",1245,37.387061,121.600455,"political"
NA,NA,NA,"OK","Laishan, Yantai, Shandong, China",1246,37.511291,121.445301,"political"
NA,NA,NA,"OK","Changdao, Yantai, Shandong, China",1247,37.921368,120.73658,"political"
NA,NA,NA,"OK","Longkou, Yantai, Shandong, China",1248,37.646108,120.477813,"political"
NA,NA,NA,"OK","Laiyang, Yantai, Shandong, China",1249,36.978941,120.711672,"political"
NA,NA,NA,"OK","Laizhou, Yantai, Shandong, China",1250,37.177129,119.942275,"political"
NA,NA,NA,"OK","Penglai, Yantai, Shandong, China",1251,37.810661,120.758848,"political"
NA,NA,NA,"OK","Zhaoyuan, Yantai, Shandong, China",1252,37.355469,120.434071,"political"
NA,NA,NA,"OK","Qixia, Yantai, Shandong, China",1253,37.335123,120.849675,"political"
NA,NA,NA,"OK","Haiyang, Yantai, Shandong, China",1254,36.776378,121.158434,"political"
NA,NA,NA,"OK","Weicheng, Weifang, Shandong, China",1255,36.7281,119.024835,"political"
NA,NA,NA,"OK","Hanting, Weifang, Shandong, China",1256,36.77549,119.219734,"political"
NA,NA,NA,"OK","Fangzi, Weifang, Shandong, China",1257,36.654448,119.166485,"political"
NA,NA,NA,"OK","Kuiwen, Weifang, Shandong, China",1258,36.70759,119.132482,"political"
NA,NA,NA,"OK","Linqu, Weifang, Shandong, China",1259,36.512506,118.542982,"political"
NA,NA,NA,"OK","Changle, Weifang, Shandong, China",1260,36.706944,118.829913,"political"
NA,NA,NA,"OK","Qingzhou, Weifang, Shandong, China",1261,36.684789,118.479654,"political"
NA,NA,NA,"OK","Zhucheng, Weifang, Shandong, China",1262,35.995654,119.410103,"political"
NA,NA,NA,"OK","Shouguang, Weifang, Shandong, China",1263,36.85576,118.790739,"political"
NA,NA,NA,"OK","Anqiu, Weifang, Shandong, China",1264,36.478493,119.218978,"political"
NA,NA,NA,"OK","Gaomi, Weifang, Shandong, China",1265,36.377539,119.757032,"political"
NA,NA,NA,"OK","Changyi, Weifang, Shandong, China",1266,36.858819,119.398525,"political"
NA,NA,NA,"OK","Rencheng, Jining, Shandong, China",1267,35.406497,116.59515,"political"
NA,NA,NA,"OK","Yanzhou, Jining, Shandong, China",1268,35.553144,116.783833,"political"
NA,NA,NA,"OK","Weishan, Jining, Shandong, China",1269,34.806554,117.128827,"political"
NA,NA,NA,"OK","Yutai, Jining, Shandong, China",1270,35.012748,116.650608,"political"
NA,NA,NA,"OK","Jinxiang, Jining, Shandong, China",1271,35.066619,116.311532,"political"
NA,NA,NA,"OK","Jiaxiang, Jining, Shandong, China",1272,35.407829,116.342442,"political"
NA,NA,NA,"OK","Wenshang, Jining, Shandong, China",1273,35.732798,116.489043,"political"
NA,NA,NA,"OK","Sishui, Jining, Shandong, China",1274,35.664323,117.251195,"political"
NA,NA,NA,"OK","Liangshan, Jining, Shandong, China",1275,35.802306,116.096044,"political"
NA,NA,NA,"OK","Qufu, Jining, Shandong, China",1276,35.580996,116.986503,"political"
NA,NA,NA,"OK","Zoucheng, Jining, Shandong, China",1277,35.405184,117.003743,"political"
NA,NA,NA,"OK","Taishan, Tai'an, Shandong, China",1278,36.192083,117.135354,"political"
NA,NA,NA,"OK","Daiyue, Tai'an, Shandong, China",1279,36.187989,117.041581,"political"
NA,NA,NA,"OK","Ningyang, Tai'an, Shandong, China",1280,35.758786,116.805796,"political"
NA,NA,NA,"OK","Dongping, Tai'an, Shandong, China",1281,35.937102,116.470304,"political"
NA,NA,NA,"OK","Xintai, Tai'an, Shandong, China",1282,35.909032,117.767952,"political"
NA,NA,NA,"OK","Feicheng, Tai'an, Shandong, China",1283,36.182571,116.768358,"political"
NA,NA,NA,"OK","Huancui, Weihai, Shandong, China",1284,37.50199,122.123443,"political"
NA,NA,NA,"OK","Wendeng, Weihai, Shandong, China",1285,37.193882,122.057988,"political"
NA,NA,NA,"OK","Rongcheng, Weihai, Shandong, China",1286,37.16516,122.486657,"political"
NA,NA,NA,"OK","Rushan, Weihai, Shandong, China",1287,36.919816,121.539764,"political"
NA,NA,NA,"OK","Donggang, Rizhao, Shandong, China",1288,35.425474,119.462228,"political"
NA,NA,NA,"OK","Lanshan, Rizhao, Shandong, China",1289,35.121884,119.318928,"political"
NA,NA,NA,"OK","Wulian, Rizhao, Shandong, China",1290,35.750083,119.208742,"political"
NA,NA,NA,"OK","Juxian, Rizhao, Shandong, China",1291,35.579868,118.837063,"political"
NA,NA,NA,"OK","Laicheng, Laiwu, Shandong, China",1292,36.203179,117.659884,"political"
NA,NA,NA,"OK","Gangcheng, Laiwu, Shandong, China",1293,36.058572,117.811354,"political"
NA,NA,NA,"OK","Lanshan, Linyi, Shandong, China",1294,35.051804,118.347843,"political"
NA,NA,NA,"OK","Luozhuang, Linyi, Shandong, China",1295,34.996741,118.284786,"political"
NA,NA,NA,"OK","Hedong, Linyi, Shandong, China",1296,35.089916,118.402893,"political"
NA,NA,NA,"OK","Yinan, Linyi, Shandong, China",1297,35.550217,118.465221,"political"
NA,NA,NA,"OK","Tancheng, Linyi, Shandong, China",1298,34.613586,118.367215,"political"
NA,NA,NA,"OK","Yishui, Linyi, Shandong, China",1299,35.79045,118.627917,"political"
NA,NA,NA,"OK","Lanling, Linyi, Shandong, China",1300,34.857149,118.07065,"political"
NA,NA,NA,"OK","Feixian, Linyi, Shandong, China",1301,35.26596,117.977325,"political"
NA,NA,NA,"OK","Pingyi, Linyi, Shandong, China",1302,35.505943,117.640352,"political"
NA,NA,NA,"OK","Junan, Linyi, Shandong, China",1303,35.174846,118.835163,"political"
NA,NA,NA,"OK","Mengyin, Linyi, Shandong, China",1304,35.719396,117.953621,"political"
NA,NA,NA,"OK","Linshu, Linyi, Shandong, China",1305,34.919851,118.650781,"political"
NA,NA,NA,"OK","Decheng, Dezhou, Shandong, China",1306,37.450804,116.29947,"political"
NA,NA,NA,"OK","Lingcheng, Dezhou, Shandong, China",1307,37.335794,116.576092,"political"
NA,NA,NA,"OK","Ningjin, Dezhou, Shandong, China",1308,37.652189,116.800306,"political"
NA,NA,NA,"OK","Qingyun, Dezhou, Shandong, China",1309,37.775349,117.385256,"political"
NA,NA,NA,"OK","Linyi, Dezhou, Shandong, China",1310,37.189797,116.866799,"political"
NA,NA,NA,"OK","Qihe, Dezhou, Shandong, China",1311,36.783414,116.76281,"political"
NA,NA,NA,"OK","Pingyuan, Dezhou, Shandong, China",1312,37.165323,116.434032,"political"
NA,NA,NA,"OK","Xiajin, Dezhou, Shandong, China",1313,36.948371,116.001726,"political"
NA,NA,NA,"OK","Wucheng, Dezhou, Shandong, China",1314,37.213311,116.069302,"political"
NA,NA,NA,"OK","Leling, Dezhou, Shandong, China",1315,37.729907,117.231934,"political"
NA,NA,NA,"OK","Yucheng, Dezhou, Shandong, China",1316,36.933812,116.638327,"political"
NA,NA,NA,"OK","Dongchangfu, Liaocheng, Shandong, China",1317,36.434645,115.988491,"political"
NA,NA,NA,"OK","Yanggu, Liaocheng, Shandong, China",1318,36.114392,115.79182,"political"
NA,NA,NA,"OK","Shenxian, Liaocheng, Shandong, China",1319,36.233598,115.671191,"political"
NA,NA,NA,"OK","Chiping, Liaocheng, Shandong, China",1320,36.580689,116.25527,"political"
NA,NA,NA,"OK","Dong'e, Liaocheng, Shandong, China",1321,36.334917,116.247579,"political"
NA,NA,NA,"OK","Guanxian, Liaocheng, Shandong, China",1322,36.484009,115.442739,"political"
NA,NA,NA,"OK","Gaotang, Liaocheng, Shandong, China",1323,36.865827,116.231416,"political"
NA,NA,NA,"OK","Linqing, Liaocheng, Shandong, China",1324,36.838277,115.704881,"political"
NA,NA,NA,"OK","Bincheng, Binzhou, Shandong, China",1325,37.430724,118.019326,"political"
NA,NA,NA,"OK","Zhanhua, Binzhou, Shandong, China",1326,37.69926,118.098902,"political"
NA,NA,NA,"OK","Huimin, Binzhou, Shandong, China",1327,37.489877,117.509921,"political"
NA,NA,NA,"OK","Yangxin, Binzhou, Shandong, China",1328,37.641106,117.578262,"political"
NA,NA,NA,"OK","Wudi, Binzhou, Shandong, China",1329,37.77026,117.625696,"political"
NA,NA,NA,"OK","Boxing, Binzhou, Shandong, China",1330,37.150226,118.131815,"political"
NA,NA,NA,"OK","Zouping, Binzhou, Shandong, China",1331,36.862989,117.743109,"political"
NA,NA,NA,"OK","Mudan, Heze, Shandong, China",1332,35.252512,115.417826,"political"
NA,NA,NA,"OK","Dingtao, Heze, Shandong, China",1333,35.071102,115.573036,"political"
NA,NA,NA,"OK","Caoxian, Heze, Shandong, China",1334,34.825508,115.542328,"political"
NA,NA,NA,"OK","Shanxian, Heze, Shandong, China",1335,34.778808,116.107428,"political"
NA,NA,NA,"OK","Chengwu, Heze, Shandong, China",1336,34.952459,115.889765,"political"
NA,NA,NA,"OK","Juye, Heze, Shandong, China",1337,35.387374,116.065396,"political"
NA,NA,NA,"OK","Yuncheng, Heze, Shandong, China",1338,35.599757,115.943613,"political"
NA,NA,NA,"OK","Juancheng, Heze, Shandong, China",1339,35.563408,115.510192,"political"
NA,NA,NA,"OK","Dongming, Heze, Shandong, China",1340,35.289368,115.089905,"political"
NA,NA,NA,"OK","Zhongyuan, Zhengzhou, Henan, China",1341,34.748256,113.61285,"political"
NA,NA,NA,"OK","Erqi, Zhengzhou, Henan, China",1342,34.723946,113.640177,"political"
NA,NA,NA,"OK","Guancheng, Zhengzhou, Henan, China",1343,34.749845,113.692648,"political"
NA,NA,NA,"OK","Jinshui, Zhengzhou, Henan, China",1344,34.800156,113.660554,"political"
NA,NA,NA,"OK","Shangjie, Zhengzhou, Henan, China",1345,34.80278,113.308961,"political"
NA,NA,NA,"OK","Huiji, Zhengzhou, Henan, China",1346,34.867457,113.6169,"political"
NA,NA,NA,"OK","Zhongmu, Zhengzhou, Henan, China",1347,34.718936,113.976254,"political"
NA,NA,NA,"OK","Gongyi, Zhengzhou, Henan, China",1348,34.747834,113.022496,"political"
NA,NA,NA,"OK","Xingyang, Zhengzhou, Henan, China",1349,34.787375,113.38322,"political"
NA,NA,NA,"OK","Xinmi, Zhengzhou, Henan, China",1350,34.539442,113.39089,"political"
NA,NA,NA,"OK","Xinzheng, Zhengzhou, Henan, China",1351,34.395562,113.740529,"political"
NA,NA,NA,"OK","Dengfeng, Zhengzhou, Henan, China",1352,34.454443,113.050581,"political"
NA,NA,NA,"OK","Longting, Kaifeng, Henan, China",1353,34.818622,114.323688,"political"
NA,NA,NA,"OK","Shunhe, Kaifeng, Henan, China",1354,34.800458,114.364875,"political"
NA,NA,NA,"OK","Gulou, Kaifeng, Henan, China",1355,34.78856,114.348306,"political"
NA,NA,NA,"OK","Yuwangtai, Kaifeng, Henan, China",1356,34.777104,114.34817,"political"
NA,NA,NA,"OK","Jin Ming Xi Jie, Longting Qu, Kaifeng Shi, Henan Sheng, China",1357,34.7883392,114.2970529,"route"
NA,NA,NA,"OK","Xiangfu, Kaifeng, Henan, China",1358,34.756916,114.441285,"political"
NA,NA,NA,"OK","Qixian, Kaifeng, Henan, China",1359,34.549174,114.783139,"political"
NA,NA,NA,"OK","Tongxu, Kaifeng, Henan, China",1360,34.480433,114.467467,"political"
NA,NA,NA,"OK","Weishi, Kaifeng, Henan, China",1361,34.411494,114.193081,"political"
NA,NA,NA,"OK","Lankao, Kaifeng, Henan, China",1362,34.822211,114.821348,"political"
NA,NA,NA,"OK","Laocheng, Luoyang, Henan, China",1363,34.683646,112.469023,"political"
NA,NA,NA,"OK","Xigong, Luoyang, Henan, China",1364,34.6599,112.428413,"political"
NA,NA,NA,"OK","Chanhe, Luoyang, Henan, China",1365,34.67985,112.500205,"political"
NA,NA,NA,"OK","Jianxi, Luoyang, Henan, China",1366,34.658033,112.395755,"political"
NA,NA,NA,"OK","Jili, Luoyang, Henan, China",1367,34.900889,112.589052,"political"
NA,NA,NA,"OK","Luolong, Luoyang, Henan, China",1368,34.619404,112.464172,"political"
NA,NA,NA,"OK","Mengjin, Luoyang, Henan, China",1369,34.825306,112.445252,"political"
NA,NA,NA,"OK","Xin'an, Luoyang, Henan, China",1370,34.728584,112.132488,"political"
NA,NA,NA,"OK","Luanchuan, Luoyang, Henan, China",1371,33.785698,111.615768,"political"
NA,NA,NA,"OK","Songxian, Luoyang, Henan, China",1372,34.134516,112.085634,"political"
NA,NA,NA,"OK","Ruyang, Luoyang, Henan, China",1373,34.153939,112.473139,"political"
NA,NA,NA,"OK","Yiyang, Luoyang, Henan, China",1374,34.514644,112.179238,"political"
NA,NA,NA,"OK","Luoning, Luoyang, Henan, China",1375,34.389414,111.653039,"political"
NA,NA,NA,"OK","Yichuan, Luoyang, Henan, China",1376,34.421459,112.425651,"political"
NA,NA,NA,"OK","Yanshi, Luoyang, Henan, China",1377,34.72722,112.789534,"political"
NA,NA,NA,"OK","Xinhua, Pingdingshan, Henan, China",1378,33.737251,113.293977,"political"
NA,NA,NA,"OK","Weidong, Pingdingshan, Henan, China",1379,33.734706,113.335192,"political"
NA,NA,NA,"OK","Shilong, Pingdingshan, Henan, China",1380,33.898713,112.898818,"political"
NA,NA,NA,"OK","Zhanhe, Pingdingshan, Henan, China",1381,33.725681,113.320873,"political"
NA,NA,NA,"OK","Baofeng, Pingdingshan, Henan, China",1382,33.868434,113.054801,"political"
NA,NA,NA,"OK","Yexian, Pingdingshan, Henan, China",1383,33.626731,113.357239,"political"
NA,NA,NA,"OK","Lushan, Pingdingshan, Henan, China",1384,33.738293,112.908202,"political"
NA,NA,NA,"OK","Jiaxian, Pingdingshan, Henan, China",1385,33.971787,113.212609,"political"
NA,NA,NA,"OK","Wugang, Pingdingshan, Henan, China",1386,33.307776,113.524794,"political"
NA,NA,NA,"OK","Ruzhou, Pingdingshan, Henan, China",1387,34.167029,112.844517,"political"
NA,NA,NA,"OK","Wenfeng, Anyang, Henan, China",1388,36.090468,114.357082,"political"
NA,NA,NA,"OK","Beiguan, Anyang, Henan, China",1389,36.10766,114.355742,"political"
NA,NA,NA,"OK","Yindu, Anyang, Henan, China",1390,36.10989,114.303553,"political"
NA,NA,NA,"OK","Long'an, Anyang, Henan, China",1391,36.076225,114.301331,"political"
NA,NA,NA,"OK","Anyang, Henan, China",1392,36.130584,114.130207,"political"
NA,NA,NA,"OK","Tangyin, Anyang, Henan, China",1393,35.924514,114.357763,"political"
NA,NA,NA,"OK","Huaxian, Anyang, Henan, China",1394,35.575417,114.519311,"political"
NA,NA,NA,"OK","Neihuang, Anyang, Henan, China",1395,35.971704,114.901452,"political"
NA,NA,NA,"OK","Linzhou, Anyang, Henan, China",1396,36.083046,113.820129,"political"
NA,NA,NA,"OK","Heshan, Hebi, Henan, China",1397,35.954611,114.163258,"political"
NA,NA,NA,"OK","Shancheng, Hebi, Henan, China",1398,35.897702,114.184427,"political"
NA,NA,NA,"OK","Qibin, Hebi, Henan, China",1399,35.741296,114.298693,"political"
NA,NA,NA,"OK","Xunxian, Hebi, Henan, China",1400,35.67636,114.55091,"political"
NA,NA,NA,"OK","Qixian, Hebi, Henan, China",1401,35.607762,114.197651,"political"
NA,NA,NA,"OK","Hongqi, Xinxiang, Henan, China",1402,35.30385,113.875245,"political"
NA,NA,NA,"OK","Weibin, Xinxiang, Henan, China",1403,35.301992,113.865663,"political"
NA,NA,NA,"OK","Fengquan, Xinxiang, Henan, China",1404,35.383978,113.915184,"political"
NA,NA,NA,"OK","Muye, Xinxiang, Henan, China",1405,35.315039,113.908772,"political"
NA,NA,NA,"OK","Xinxiang, Henan, China",1406,35.303704,113.926763,"locality"
NA,NA,NA,"OK","Huojia, Xinxiang, Henan, China",1407,35.259808,113.657433,"political"
NA,NA,NA,"OK","Yuanyang, Xinxiang, Henan, China",1408,35.052761,113.967907,"political"
NA,NA,NA,"OK","Yanjin, Xinxiang, Henan, China",1409,35.141889,114.20509,"political"
NA,NA,NA,"OK","Fengqiu, Xinxiang, Henan, China",1410,35.041198,114.418882,"political"
NA,NA,NA,"OK","Changyuan, Xinxiang, Henan, China",1411,35.201548,114.668936,"political"
NA,NA,NA,"OK","Weihui, Xinxiang, Henan, China",1412,35.398494,114.064907,"political"
NA,NA,NA,"OK","Huixian, Xinxiang, Henan, China",1413,35.462312,113.805468,"political"
NA,NA,NA,"OK","Jiefang, Jiaozuo, Henan, China",1414,35.240282,113.230817,"political"
NA,NA,NA,"OK","Zhongzhan, Jiaozuo, Henan, China",1415,35.236819,113.182946,"political"
NA,NA,NA,"OK","Macun, Jiaozuo, Henan, China",1416,35.256108,113.322332,"political"
NA,NA,NA,"OK","Shanyang, Jiaozuo, Henan, China",1417,35.214507,113.254881,"political"
NA,NA,NA,"OK","Xiuwu, Jiaozuo, Henan, China",1418,35.223514,113.447755,"political"
NA,NA,NA,"OK","Bo'ai, Jiaozuo, Henan, China",1419,35.171045,113.064379,"political"
NA,NA,NA,"OK","Wuzhi, Jiaozuo, Henan, China",1420,35.099378,113.401679,"political"
NA,NA,NA,"OK","Wenxian, Jiaozuo, Henan, China",1421,34.940189,113.08053,"political"
NA,NA,NA,"OK","Qinyang, Jiaozuo, Henan, China",1422,35.087539,112.950716,"political"
NA,NA,NA,"OK","Mengzhou, Jiaozuo, Henan, China",1423,34.907315,112.791401,"political"
NA,NA,NA,"OK","Hualong, Puyang, Henan, China",1424,35.777346,115.074151,"political"
NA,NA,NA,"OK","Qingfeng, Puyang, Henan, China",1425,35.88518,115.104389,"political"
NA,NA,NA,"OK","Nanle, Puyang, Henan, China",1426,36.069602,115.20474,"political"
NA,NA,NA,"OK","Fanxian, Puyang, Henan, China",1427,35.851906,115.504201,"political"
NA,NA,NA,"OK","Taiqian, Puyang, Henan, China",1428,35.96939,115.871906,"political"
NA,NA,NA,"OK","Puyang, Henan, China",1429,35.712193,115.029078,"political"
NA,NA,NA,"OK","Weidu, Xuchang, Henan, China",1430,34.025341,113.822647,"political"
NA,NA,NA,"OK","Xuchang, Henan, China",1431,34.12466,113.822983,"political"
NA,NA,NA,"OK","Yanling, Xuchang, Henan, China",1432,34.102332,114.177399,"political"
NA,NA,NA,"OK","Xiangcheng, Xuchang, Henan, China",1433,33.846369,113.482453,"political"
NA,NA,NA,"OK","Yuzhou, Xuchang, Henan, China",1434,34.140701,113.488478,"political"
NA,NA,NA,"OK","Changge, Xuchang, Henan, China",1435,34.194135,113.819888,"political"
NA,NA,NA,"OK","Yuanhui, Luohe, Henan, China",1436,33.565441,114.017948,"political"
NA,NA,NA,"OK","Yancheng, Luohe, Henan, China",1437,33.587409,114.006943,"political"
NA,NA,NA,"OK","Shaoling, Luohe, Henan, China",1438,33.586565,114.093902,"political"
NA,NA,NA,"OK","Wuyang, Luohe, Henan, China",1439,33.437877,113.609286,"political"
NA,NA,NA,"OK","Linying, Luohe, Henan, China",1440,33.828042,113.931261,"political"
NA,NA,NA,"OK","Hubin, Sanmenxia, Henan, China",1441,34.770885,111.188397,"political"
NA,NA,NA,"OK","Shanzhou, Sanmenxia, Henan, China",1442,34.720547,111.103563,"political"
NA,NA,NA,"OK","Mianchi, Sanmenxia, Henan, China",1443,34.767951,111.761797,"political"
NA,NA,NA,"OK","Lushi, Sanmenxia, Henan, China",1444,34.054324,111.047858,"political"
NA,NA,NA,"OK","Yima, Sanmenxia, Henan, China",1445,34.7474,111.87448,"political"
NA,NA,NA,"OK","Lingbao, Sanmenxia, Henan, China",1446,34.516828,110.89422,"political"
NA,NA,NA,"OK","Wancheng, Nanyang, Henan, China",1447,33.003784,112.539558,"political"
NA,NA,NA,"OK","Wolong, Nanyang, Henan, China",1448,32.989877,112.528789,"political"
NA,NA,NA,"OK","Nanzhao, Nanyang, Henan, China",1449,33.489877,112.429133,"political"
NA,NA,NA,"OK","Fangcheng, Nanyang, Henan, China",1450,33.254391,113.012494,"political"
NA,NA,NA,"OK","Xixia, Nanyang, Henan, China",1451,33.298364,111.482591,"political"
NA,NA,NA,"OK","Zhenping, Nanyang, Henan, China",1452,33.034111,112.234697,"political"
NA,NA,NA,"OK","Neixiang, Nanyang, Henan, China",1453,33.044864,111.849392,"political"
NA,NA,NA,"OK","Xichuan, Nanyang, Henan, China",1454,33.13782,111.490964,"political"
NA,NA,NA,"OK","Sheqi, Nanyang, Henan, China",1455,33.056109,112.948245,"political"
NA,NA,NA,"OK","Tanghe, Nanyang, Henan, China",1456,32.697086,112.840602,"political"
NA,NA,NA,"OK","Xinye, Nanyang, Henan, China",1457,32.520805,112.360026,"political"
NA,NA,NA,"OK","Tongbai, Nanyang, Henan, China",1458,32.367401,113.406491,"political"
NA,NA,NA,"OK","Dengzhou, Nanyang, Henan, China",1459,32.687733,112.087455,"political"
NA,NA,NA,"OK","Liangyuan, Shangqiu, Henan, China",1460,34.443893,115.613965,"political"
NA,NA,NA,"OK","Suiyang, Shangqiu, Henan, China",1461,34.388389,115.653302,"political"
NA,NA,NA,"OK","Minquan, Shangqiu, Henan, China",1462,34.647758,115.179594,"political"
NA,NA,NA,"OK","Suixian, Shangqiu, Henan, China",1463,34.445655,115.071879,"political"
NA,NA,NA,"OK","Ningling, Shangqiu, Henan, China",1464,34.460231,115.313737,"political"
NA,NA,NA,"OK","Zhecheng, Shangqiu, Henan, China",1465,34.091082,115.305708,"political"
NA,NA,NA,"OK","Yucheng, Shangqiu, Henan, China",1466,34.402512,115.840511,"political"
NA,NA,NA,"OK","Xiayi, Shangqiu, Henan, China",1467,34.237553,116.131447,"political"
NA,NA,NA,"OK","Yongcheng, Shangqiu, Henan, China",1468,33.929291,116.4495,"political"
NA,NA,NA,"OK","Shihe, Xinyang, Henan, China",1469,32.116803,114.058713,"political"
NA,NA,NA,"OK","Pingqiao, Xinyang, Henan, China",1470,32.101031,114.125656,"political"
NA,NA,NA,"OK","Luoshan, Xinyang, Henan, China",1471,32.203072,114.513012,"political"
NA,NA,NA,"OK","Guangshan, Xinyang, Henan, China",1472,32.009995,114.91925,"political"
NA,NA,NA,"OK","Xinxian, Xinyang, Henan, China",1473,31.643918,114.879239,"political"
NA,NA,NA,"OK","Shangcheng, Xinyang, Henan, China",1474,31.798377,115.406862,"political"
NA,NA,NA,"OK","Gushi, Xinyang, Henan, China",1475,32.168137,115.654481,"political"
NA,NA,NA,"OK","Huangchuan, Xinyang, Henan, China",1476,32.131522,115.051908,"political"
NA,NA,NA,"OK","Huaibin, Xinyang, Henan, China",1477,32.473258,115.419537,"political"
NA,NA,NA,"OK","Xixian, Xinyang, Henan, China",1478,32.342792,114.740456,"political"
NA,NA,NA,"OK","Chuanhui, Zhoukou, Henan, China",1479,33.647598,114.650628,"political"
NA,NA,NA,"OK","Fugou, Zhoukou, Henan, China",1480,34.059968,114.394821,"political"
NA,NA,NA,"OK","Xihua, Zhoukou, Henan, China",1481,33.767407,114.529756,"political"
NA,NA,NA,"OK","Shangshui, Zhoukou, Henan, China",1482,33.542138,114.611651,"political"
NA,NA,NA,"OK","Shenqiu, Zhoukou, Henan, China",1483,33.409368,115.098583,"political"
NA,NA,NA,"OK","Dancheng, Zhoukou, Henan, China",1484,33.644743,115.177188,"political"
NA,NA,NA,"OK","Huaiyang, Zhoukou, Henan, China",1485,33.731561,114.886153,"political"
NA,NA,NA,"OK","Taikang, Zhoukou, Henan, China",1486,34.064463,114.837888,"political"
NA,NA,NA,"OK","Luyi, Zhoukou, Henan, China",1487,33.86,115.484454,"political"
NA,NA,NA,"OK","Xiangcheng, Zhoukou, Henan, China",1488,33.465838,114.875333,"political"
NA,NA,NA,"OK","Yicheng, Zhumadian, Henan, China",1489,32.973054,113.993914,"political"
NA,NA,NA,"OK","Xiping, Zhumadian, Henan, China",1490,33.387684,114.021538,"political"
NA,NA,NA,"OK","Shangcai, Zhumadian, Henan, China",1491,33.262439,114.264381,"political"
NA,NA,NA,"OK","Pingyu, Zhumadian, Henan, China",1492,32.96271,114.619159,"political"
NA,NA,NA,"OK","Zhengyang, Zhumadian, Henan, China",1493,32.605697,114.392773,"political"
NA,NA,NA,"OK","Queshan, Zhumadian, Henan, China",1494,32.802064,114.026429,"political"
NA,NA,NA,"OK","Biyang, Zhumadian, Henan, China",1495,32.723975,113.327144,"political"
NA,NA,NA,"OK","Runan, Zhumadian, Henan, China",1496,33.006729,114.362379,"political"
NA,NA,NA,"OK","Suiping, Zhumadian, Henan, China",1497,33.145649,114.013182,"political"
NA,NA,NA,"OK","Xincai, Zhumadian, Henan, China",1498,32.744896,114.96547,"political"
NA,NA,NA,"OK","Jiyuan, Henan, China",1499,35.067243,112.601918,"political"
NA,NA,NA,"OK","Jiang'an, Wuhan, Hubei, China",1500,30.600064,114.309091,"political"
